0,"Jien ilma tal-vit ma nixrobx ghax mhux tajjeb. L-ilma mhux ghal-loki u ghall-hasil biss qieghed. U jekk ma ndunajtx, forsi int ma ssuqx, il-maggoranza tat-toroq Maltin imzabba minhabba x-xoghol hazin li jsir meta 'jiswew' is-servizzi tal-ilma. Qabel ma jitqieghdu s-servizzi sewwa ma tistax tirranga t-toroq! Possibbli qatt ma ndunajt li triq b'wicc gdid wara ftit xhur tibda tara l-ewwel sinjali ta' purkerija ta' xoghol tal-WSC jew il-kuntratturi taghha? Il-prosit intih lil min jaf jaghmlu x-xoghol; wara kollox l-ilma mhux b'xejn u meta nhallas, nhallas ghall-ilma tajjeb u mhux ghal dak li ghandu toghma ta' medicina u chlorine u li lanqas ghat-tisqija mhu tajjeb ahseb u ara ghan-nies f'pajjiz suppost zviluppat!"
1,Jien mort u ħadt ħafna gost.
0,Il-knisja trid tinbidel !!!
1,Il-kliem hu faċli u l-pajjiż jippermetti l-espressjoni ħielsa sempliċiment bħala mekkaniżmu ta' difiża li jservi biss bħala sfog ħalli inaqqas ftit ir-rabja.
0,Tinsewx li dawn it-terroristi għandhom il-moviment ħieles u jistgħu jiġu Malta bla ebda xkiel kif qed jiġu l-kriminali l-oħra jisirqu minn pajjiżna.
1,Artiklu tajjeb. Riflessjonijiet interessanti fuq ir-reliġjon u l-kurja.
0,Pero jiena mhux qed nara jikkrejaw impjieg ta' kwalita ferm għolja għal ħaddiema Maltin Prim Ministru!
