0,"Siis vetävät HETERON roolia, mutta lomansa viettävät HOMObaareissa..."
0,"Raukkamaisina pelkureina he eivät uskalla katsoa oman oppinsa pahuutta silmiin pitäen Stalinin miljoonateurastuksia vähäpätöisempänä asiana kuin sitä, että amerikkalaissotilaat riisuivat alastomiksi irakilaisterroristeja."
1,Heidän ottelunsa wrestlemanioissa 16 (Jericho kolmantena) ja 17 olivat ehdottomia klassikoita.
0,"tuli eu potaskaa kerrakseen ilman perusteluja joihin ei talollinen kuten yleensäkään eu mieliset kykene muttta eun vastustajat voivat perustella näkemyksensä joten..1,eu ei mitenkään voi olla ainoa ekonomis-realiinen vaihtoehto suomelle siis potaskaa a""la talollinen:) 2.nato on ainut puolustus poliittinen vaihtoehto suomelle?"
1,Ja ulkoilu raittissa ilmassa auttaa kans pitämään mielen vireämpänä.
1,Kiitos etukäteen vaivannäöstä
0,"Uusi aika.., -sepustuksesi kuulostaa hyvin vanhanaikaselta ajaltaa."
0,"Ja just sillon kun olen väsynyt, tai surullinen, isä alkaa ärsyttämään laulamalla kaikkea minusta, tuntuu niin raskaalta, kun ei pysty pakenemaan, ja jos pyytää että lopettaisi, hän jatkaa entistä ärsyttävämmin, ja usein juttelen surullisena kaverin kanssa koneella, niin isä vaa laulaa vieressä että ""Tietokoneella olen pitkään, olen kahlittu tietokoneeseen kiinni."""
1,Hei!
1,"Kaikki muut Eddingsit on tullut luettua useamman kerran...ja ei voi muuta sanoa kuin, on joka kerta jotain uutta ollut niissä kirjoissa...aina huomaa jotain syvällisempiä merkityksiä henkilöissä ja tarinassa yleensä..."
1,Ja se johtotähti siinä keulalla kruunaa kaiken!
1,Askohan toimii kuten sivistyneen herrahenkilön on toimittava.
1,"Tuohan on hyvä systeemi, että maustamattoman jugurtin seassa annat eri hedelmäsoseita.. :)"
1,"Tomppa, siinä tavallaan miehen ihanuus onkin, lapsi ja aikuinen samaan aikaan:)"
1,"Eniro yritti varastaa siitä yli puolet mutta minä käytin sen itse, luin ja ajattelin koko ajan :)"
1,Olisit vaan lähtenyt mun mukaan sunnaritreffeille;)
0,Sanoisin ettei ole reilua verrata aspergeria alkoholistiin.
0,"No ei mikään ihme, en minäkään suostuisi."
0,Hemmetin naine!
0,Ei ne syyt lopu koskaan.
1,"Olemme suhteellisen onnellisia yhdessä, koska on asioita, joista voimme puhua.
-1	0	0	0	2	1	1	14	4	comments2013e.vrt 92510	Kas kun eivät syöttäneet kissoille (leijonia teillä tuskin oli tarjolla).
-1	-1	0	-1	2	-1	-1	9	4	comments2007g.vrt 1417764	Ettei vain olisi taas joku koijaus niin kuin oli tuo tanskalaisten viritelmä jokin aika sitten jossa sivut kuulemma katosivat muutaman kuukauden jälkeen ja rahat savuna ilmaan.
-1	-1	-1	-1	1	0	-1	4	4	comments2005b.vrt 1081907	Mikä siinä on että on ängettävä heti ohittamisen jälkeen omalle kaistalle keulaa hipoen moottoritiellä?"
0,"Enkä pidä siitä, että sun kaltainen pahansuopa psykopaattikirjoittaja rinnastaa _minut_ suurinpiirtein psykopaattin, vaikka aina kirjoitan vain kriittisesti vihaviestintään tässä Suomi24:a."
1,Kokenut mies ymmärtää kyllä jos et osaa ja opettaa varmasti mielellään.
1,Onneksi voi vapaasti valita mihin menee.
1,Informaatiota kiitos :)
1,"Tietenkin maltti on valttia, mutta pitää elää myös niin kuin hyvältä tuntuu:)"
0,Onneksi Islam ei ole Sinua vielä pilannut.
1,Mukavaa viikonloppua Sinulle!
0,"Itselläni kävi tässä kerran niin, että eräs mies käyttäytyi minua kohtaan todella kylmästi, siinä sitten mietin omaa käyttäytymistäni, mitä olin tehnyt väärin..."
1,":-) noita välejä olisi kannattanut oman perheen kanssa parantaa ja sopia, jo ihan sillon kun Johanna olisi kuvitteellisesti Julian kuoleman jälkeen lähtenyt vanhempiensa ja sisaruksiensa kanssa yhtä matkaa Ruotsiin, perheen kotia kohti."
0,"Tänään on potissa Vain Kuppaset 18 Miljoonaa, joten ei kantsi Välttis veikata, kun siinähän häviäisi 72 Miljoonaa, jos voittaisi näin Kuppasen potin Kunnon Potin sijaan.. ;D.. Ottais vain päähän, eikä osais nauttia voitosta.."
0,Kun taas miettii niin kasvaako ne paljoo paskaakaa?
0,"Lieksalaisten yleinen leimaaminen rasisteiksi on loputtava, sillä sekin on tavallaan rasismia ja loukkaa monia lieksalaisia."
1,"Toivon roppakaupalla onnea ja rakkautta elämäsi varrelle, ansaitset sen!"
0,Ja miten niin 'ei mitään syytä pitää tätä'?!!
0,Kyllä Sosialismi on kantanut kauheaa hedelmää.
0,En kestä :'(
0,Nörtit on hanurista
0,"Nuorgamin Jounin pakeille, kuulemma ois skooterin suunnannut!!!Jospas se apu löytyis!!!"
1,"Johan mä tonttuilin viime yönäkin, tosin sain paljon aikaiseksikin.:)"
1,"Ka niitähän löytyy niinkin ihmeellisistä paikoista, kuin rautakaupoista ja tavarataloista ;-)"
0,Tuollainen kielenkäyttö osoittaa ettei hän kunnioita sinua tippaakaan.
1,Parempaa onnea seuraavaan elämään!
0,"Mikä muuttaa miehen ajatusmaailman noin mustavalkoiseksi ja miten voi vihata yhtä automerkkiä noin paljon kuin sinä, onko sinua kohdeltu huonosti lapsena?"
0,"Ahaa, sinulla on oikein suunnitelma maailman pelastamiseksi."
0,Karvainen pillu kertoo nykyään että nainen ei halua pitää hygieniastaan huolta.
0,"Ala-arvoisin provoaloitus, joka on nyt yläpalkkissa on..."
1,MAAILMAN IHANIMMALLE MIEHELLE!
0,"Kovin on pieniä sun ongelmat, jos noista kyllästyy, niin meneppäs kokeilemaan jotain toista merkkiä..."
1,Me on asuttu Torniossa 3 vuotta ja minusta on kyllä kiva paikka.
1,LOL!!
0,"Tai sitten saunassa vaan oli niin h*vetin kylmä, olis kassit huurtunut muuten..."
1,Tsemppiä.
0,Mutta mitä?!?!
0,HÄIVY HIHHULI
0,Laita äijä äkkiä vaihtoon!
0,Joten lopettakaa kaikenlainen paskanjauhaminen ja katsokaa omaan sydämeenne mitä siellä on.
1,Moi!
1,Nami nami!
1,"Hei,mites tämä nyt ihastumiseen liittyy? :D mutta siitä lahjasta,kaíkki RAKKAUDELLA hankittu kelpaa,ja on mieluista."
1,heehhhhhhhhhhhhhhhhhhhhhhhhhehheehheehehhhhhhhhhheeee
0,Kerran hän uhkasi tappaa minut ja silloin lähdin.
0,Tyhmiä kysymyksiä
1,Voimia ja lämmin halaus vielä kerran!
1,voi pitää hyvin paikkansa ;)
1,Tutustumaan Toisiimme Paremmin Kuin Omiin Taskuihimme:) Hyvää Yötä Ja Kauniita Unia:) Nuku Tosi Hyvin:) Palailen Aamulla:)
1,"Siellä erilaisuus on lähinnä rikkaus (asuin siis itärannikolla) ja älkää uskoko televisiota, ei sielläkään ulkonäkö ole kaikki!"
1,Joo.
0,"Ei kukaan kannata.Mukava kun on sukulaisia, muuten kuin aloittaja surkea sukulaiseton vasuri räkyttäjä."
1,Hyvää yötä ja sykettä rintaan yön yli!
0,"Työttömiä ei todellakaan ole hemmoteltu: heitä on rääkätty ja alistettu työkkärin taholta ja pakotettu pilipalikursseille tai 9 € pakkotöihin vain, jotta poliitikot voisivat päteä ja esittää vähentäneensä työttömyyttä."
0,mitaan muuta en osaakaan.
1,Hei.
1,Terveitä myöhäissyksyn päiviä kaikille.
0,"Oikein ärsyttää, kun olen suuren osan elämästäni nutannut ällöttävien siteiden, pikkuhousunsuojien ja tamponien kanssa."
0,Missä perustelut mutuväitteillesi???
0,En ymmärrä miksi cheerleading ei muka olisi urheilulaji!?
0,hakisin unilääkkeet mutta pelkään taas ottavani koko paketin.
1,Ja oli muuten minunkin ensimmäinen viestini täällä ^^
1,Kyllä sulla elämän puitteet on ainakin kunnossa.
1,Kiitos teille:)
0,"ja sen lisäksi annat äijäsi kohdella sua miten tahtoo..se tulee sen tekemään edelleenkin..jos alussa suhteen ,,niin varmasti kun aikaa on mennyt..hölmö olet.."
0,mutta sanoit sen sitten olevan 600-7oooooe arvoinen.
1,Itseäöni rauhoitti tieto että hänellä on nyt kaikki hyvin.
1,Mutta semmoistahan se on jos vajaalla palikkapaketilla operoi. ;)
1,-serranossa kaikki on vallan mainioita
0,Varmasti ampuisit vain itseäsi nilkkaan yrittäessäsi vahingoittaa lisää minua.
0,"Sen jälkeen en ole käynyt, mutta voisin nyt muuten mennä, mutta en jaksa ja ehdi ajella 30 kilsaa edestakaisin tuon vuoksi."
0,Ehkä kirjoittajien kannattaisi siellä ihan käydä ja todeta kuinka asiat ovat??!!!
0,"Peruuttamaton tilanne on silloin, jos sopassa on jo mukana se kolmaskin osapuoli."
0,"Yksikään rehellinen ihminen ei edes suostu lainaamaan sinulta pankkikorttia 2-viikon tuttavuuden jälkeen vaan häpeäisi silmät päästään, jos toinen edes tarjoaisi."
0,"Tohon voi olla monta syytä.....kundikaverisi on laiskimus, mitä sitä mitään tekemään jos voi laittaa naisen asialle, jos kundikaverisi on mätisäkki kaliberia niin voi olla, et aikaisempi on valittanut et litistyy, ehkä on epävarma teknisestä osaamisestaan, haluaa välttää katsekontaktia joka helpommin vältettävissä kun nainen ratsastaa, tykkää katsella ""maisemia"" ehkä aikaisempi ollut alla makaava lahna ja on nyt innoissaan kun on saannut ridaajan :D"
0,"Olin menettänyt elämäni tärkeän kumppanin, menettänyt rakkauden kohteen ja rakastajan, olin jäänyt yksin ja halusin vain seurata häntä... kaipasin, tuijotin tielle, odotin, olin elossa, mutta kuollut elämään tätä päivää."
1,Pyydä ny jo taivaan tähden tota Emmaa deiteille.
0,Hyvä tuotto persaukisten selkänahasta revityksi.
1,"huominen on parempi päivä, meille molemmille."
0,älä ysko tota !!!!! ei lehtikaloja ja miljoonakaloja voi laittaa samaan altaaseen!!!!miljoonakalat tarvitsevat kovaa ja emäksistä vettä kun taas lehtikalat pehmeää vettä!!!!!!ja leväbarbit kasvavat liian isoiksi tuohon altaaseen ja ne tarvitsevat parven.
0,"Kuitenkin pelkästään sen osan, että naisella on oikeuksia, mutta ne tasa-arvoiset velvollisuudet tuntuu unohtuvan ikävän monelta naiselta."
0,Ei kuulosta kivalta sinunkaan tilanteesi. :(
1,Mutta huolehdi itsestäsi.
1,Kiitos
0,"Jos nyt otan eron, tunnen syyllisyyttä siitä että jätän hänet pulaan."
0,No nyt osui kovin herkkään kohtaan.
0,Olen väsynyt tähän tunteeseen.
1,Jeah
0,Multa on kuollu jo kuus hiirtä ja sit mun kaks tosi rakasta marsua(mun parhaimmat kaverit) jouduttiin antaa pois siskoni allergian takia!
0,Se on kurjaa tehdä pitkiä matkoja kränääjän kanssa ja pian menee matkasuunnitelmat poskelleen tai sitte hermot.
1,Kiitos linkistä.
1,Olen todella iloinen puolestasi!!
1,Mielipiteitä kiits!!
0,Ei se multa kyllä saanu sääliä ei...
0,onko kaikilla savea aivojen tilalla...???
1,Moikka!
0,Silloin itsetunto on niin maassa että et enää usko saavasi ketään muuta ja siksi jatkat vain petollisen kusipään kanssa.
1,Studio 55 .n aiheena oli kiinnostava laivaristeily.
0,Vain idiootti ei pelkää mielisairaalaa.
0,Kukaan aito kokoomuslainen ei kirjoittele niin kuin sinä.
0,Tietämättömät ja kärsimättömät kun harjaavat usein liian kovilla otteilla...
0,"Kaikenlainen rienaus, vihapuhe, valehtelu ja painostus yrittää eksyttää uskovaisia hylkäämään uskon ja siirtymään rienaajien leiriin."
0,"Ensinnäkin talon pystyttämisestä tuli painajainen, osat loppui koko ajan kesken, laatu oli paljon huonompi kuin myyjän näyttämissä kuvissa."
0,T R O L L I
1,läskiä porukkaa :D
0,"Ihme, kun työttömistä tehdään hulluja vain !"
0,"no siis ei epäillä että me oltais se rikottu, vaan epäillään veljen riiviölasta ja hakaneulan yhdistelmää..."
0,Korvatulppa pitää tarkoituksella tulpat jottei tarvitse kuulla raamatun vastaisia ja kauaksi oppi-isämme Lutherin opetuksista menneitä ihmisoppeja eikä isäin sääntöjä väärine seurakuntakäsityksineen.
1,..se on mitä sinulle haluan sanoa...terrorist-kramare...suomeksi jotain...terroristi-kaulaaja. ;))
1,Ja jos ihtiään kehui ni kyllä heti osoitettiin paikkaa maan pinnalla :D.
1,Moi!
1,iso ja pieni :)
0,Köyhä kansa ostaa kootaa.
0,"Ajattele,vaikka minä en ole hellari, minä en esim.ekivaarille yleensä vastaa...."
0,Mulla on oikeesti sellainen tunne että ei jaksaisi tätä enää.
0,Silti välillä tuntuu että kuolemalla kyllä osataan rahastaa...
1,Siispä me kokkolalaiset veronmaksajat lähtekäämme nyt joukolla tukemaan tuota yhdistystä kaikin voimin.
1,Kokoomusta ja Kataista ♥ ♥ :)
0,"Niin, onhan meillä maajussejakin jotka teesketelee ruokkivansa koko maan ja niiden naapurit elätettävinä."
1,Se olisi aika ihana kuulla:)
0,Siinä saa ymmärtämättömän kansan sekaisin ja nolaa itsensä!
0,Mulle yks hailee...
0,SITÄ minä en todellakaan antanut anteeksi.
0,En kyllä aina tajua noita naisia....
1,Onnea odotukseen ja tervetuloa joukkoon!!! =)
0,eiiiii....
0,"Mutta kun sinulla ei ole kumpaakaan, niin et ymmärrä, joten äänestät persuja tai punikkeja."
1,"niin mielettömiä uusia kokemuksia, että ottakaapa kaikki irti kokemuksesta!!! :D ja muistakaa, et ausseilla on tosi kummallinen huumorintaju!!!"
1,hauska!!Kiitti!
0,Tuo rekkarin arvuuttaminen on yhtä turhaa kuin melkein muistaa jonkun puhelinnumeron.....
1,Sytytä minut koko olemukseltani yhä vain syvemmin laulamaan voittosi runsaudesta
1,"En ole aborttia tehnyt, enkä tekisikään mutta se on kuitenkin joka ikisen ihmisen omapäätös:) onneksi!"
0,"mäkin petin kerran ystäväni ja nyt mä jopa valehtelen heille.kuin näyttelisi jotain helvetin romaania koko ajan ja pahinta etten osaa kuin valehdella elämästäni,jotta muut luulisivat että olisin joku neiti äydellinen,..huolestuttavaa ja painaa mieltäni koko ajan,..."
0,Olen lähettänyt ainoastaan fiksuja asiallisia viestejä naisille mut naiset ei vastaa ikinä.
1,"Pääsi onneksi painonhallintaryhmään ja toivottavasti saa pudotettua painoa pois, että pääsee sen jälkeen polvileikkauksiin."
1,"Toki tykkään myös klassikoista, kuten Psyko, Hohto, Stand by me, 8mm... mutta ylläolevat leffat edustavat parhaimpaa aatelia..."
0,Kuinka montaa ex kaveriasi muuten kusetit.
0,Tuntuu et en kuulu tänne.
1,Suosittelen!
1,"Onneksi kesä on vielä edessä ja tulee kyllä, kun vain jaksaa odottaa."
0,Suomalaisena tuollainen avuttomuus hävettää.
0,"parisuhteet lähinnä ahdistaa, liekö jotain sitoutumiskammoakin."
1,Suositelkaa jotain hyviä malleja jos tiedätte.
1,hahahahahahahahahahhaha
0,"BTW, täysin turha ketju...;)"
0,Muilta osin ne hyvät ja ilmaiset ovat vähän vähissä.
0,Omaa kopiotasi et minäksesi saa ja noin ehdoton suhtautuminen asioihin ja suvaitsemattomuus tietää varmasti ongelmia tulevaisuudessa.
1,"Kiitos, peres kauniista sanoistasi..[kats.otsikkoa] ja mukvaa 19 pv. sinne ! :)"
1,"Todella, todella tyhmä kysymys, mutta potkikaa nyt mua, jos huolehdin todella aivan turhaan :)"
0,Kateelliset äänestää näköjään Cherylle miinusta :)
1,Siinäpä se lyhykäisyydessään :)
1,"Teethän muutakin kuin ""saarnaat"" :))"
0,En kyllä suosittele.
0,Huokaus.
1,Toivotan onnea Jussi-herralle pyyteettömässä uurastuksessaan pelastaa maapallo tai ainakin Haapavesi.
0,Mitä tehdä??
0,Mutta ei ole vielä onnistunut perhe....
0,katkeruutesi on järkyttävää.
1,"Hauskinta on kun ruoka värjää katteen esim. porkkana, luumu, kurkkupastilli..."
1,"Onnellinen, etten menettänyt mitään :D"
1,Näillä saiteilla mielikuvitusongelma on yleisin ongelma ;-)
1,kiitos
1,Ehkä... :)
0,Meillä vain tällä hetkellä välimatkaa 200km ja ikävä on kova :(
0,"Hymyilette viellä 5v sisään ja kiitätte itseänne ettette koskeneet psykiatria-""lääkäreitten"" rahaa tuottaviin neuvoihin."
0,Niinhän tuo kuittaa olankohautuksella puolueensa edustajan törppöilytkin.
1,Ite oon taalla Lontoossa tallahetkella ja oikein hyvassa kielikoulussa.
0,Ihmiset ovat niin s a a t a n a n erilaisia ja erilaisen moraalin omaavia!
1,Mieskin voi nukahtaa viereen :)
1,Jos saat vastauksen nii voisikko kertoa?? :)
0,"itse kierrän kaukaa ranskan,italian tekeleet ei luikertelua maantiellä, penkin tärinää ja kojelaudan natinaa..(yksilöitä löytyy jopa citikassa..)"
1,"Totesin juuri ilokseni, että kaikista sikaviesteistä oli tehty poistopyyntö."
0,Sä olet täällä haukkunut suunnilleen kaikki talon naiset.
0,Kummatkin ovat todellisia jääräpäitä.
1,Katsoin jopa Lieksasta tehtyä poikien ohjelmaa jopa kolmea ja todella ylistävä ja hauska ja mikä parasta oikein murteella Rääkkylän pojat käyneet Lieksassa ja siinä käytiin hauskasti kylän toiminta läpi vuosi sitten ja eip' ollut haukkumista vaan mielestäni hyvin humoristinen ja siitä ainakin kiitos pojat olettte todella Lieksan markkinoijia toivottavasti tapaamme jälleen jopa nokakkain jotta voimme jatkaa paikkakunnan kuvaamista ja vahvuuksiaMK
1,Hyvää Itsenäisyyspäivää sinulle.
1,Yksi hienoista rakkauslauluista
0,eihän noilla kaupunkin sosiaalitapauksille tarkotetuilla vuokrilla kateta edes talojen kunnossapitoa.
1,Sisäinen on myös tärkeä asia.
0,Vain aukko tietämättömyyden pitkällä katkeralla saralla.Totta niin paljon joutuu kestämään elon poluilla.Mutta kiitos valaistuksesta saat kylmät väreet juoksemaan selkärankaa pitkin kun ajattelen mitä kaikkea mukani kannan.
1,"Olen odotellut sinulta jotain viestiä, kuinka voit ja jos ei ole liikaa vaivaa, laita minulle tänne viestiä jaksamisestasijos sopii:))"
0,Hähä!
0,Eikä meillä ollut edes sinkoja mukana ??
0,"ja lähiaikoina, n.puolen vuoden sisällä on tullut viitisen kiloa lisää, pelkään, että sitä lisääntyy koko ajan vaan!"
0,"Ei tarvi olla noin ahdasmielinen, vaan annetaan niille jotka siihen sitten muuttaa niin mahdollisuus ""nauttia"" näköaloista.."
0,Kunpa maailma olisi aina ilman rikollisia venäläisiä = paavo väyrynen otettaisiin häkkiin.
0,"Tuli sellainen olo että ""ei voi olla totta, taas käy näin""."
1,Ilmoita tänne jos on :)
0,"teuta, sinä valkeuden enkelinä ylistät Jeesusta ja samalla olet olet Jeesuksen seuraajien murhaaja järjestössä rahoittamassa noitarovio rikoksia!!!"
0,Jos sinulla jossain on joku ajatus isänmaan parhaaksi - niin saat sen ko. jutullasi näkymättömiin - tyystin.
0,Mikä tässä nyt on ongelmana?
0,Aina känisemässä joutavia.
0,NYT LOPPU IHASTUMISET
0,"Tukholma on sun kyläpahasees verrattuna oikee city,sä oot suuruudenhullu mielikuvitus stadilainen"
1,Vielä sitä plussaa odotellessa :)
0,Ja muut tavat ovat vääriä.
1,Kiitos!
1,Kiitos nimimerkille ressu1.
1,Tosi äijä!
0,"Ei, kyllä kaikki pitää saada mulle - ja heti!"
1,Siinä on kunnon koira eikä tyhjän louskuttaja!!
0,"Tää oli mun päivystysvuoro, ihme hannarit."
0,"Olen pahoillani, kun stereotypiasi tuottaa sinulle (taas kerran) pettymyksen."
0,Noin 50% safa-arkkitehtien omaa egoaan kohottavista luomuksista ovat käytännössä mahdottomia tai järjettömiä toteuttaa.
0,???
0,"Joten läskit muijat: YLÖS,ULOS ja LENKILLE, ei kuitenkaan makkaralenkille ;););)"
0,"Vaikka auttaisi kai joku korkeampi idoli typeriä päiväperhopoliitikkoja olemaan sentään johdonmukaisia, eikä tekemään helvetisti velkaa, koska EU ja omat firmat."
0,"Ihan yhtä paljon järkeä kuin sinun kommentissasi ""naisellinen nainen"""
1,"Kiitos avustasi &amp;&amp;&amp;&amp;, minun on tullut aika ottaa askel eteenpäin elämässäni, ja aikanaan kehottaa veljiäni tekemään samoin."
0,En Finne Igen mutta ei me ikinä raiskattu ketään.
1,"Hyvää kevättä sinulle, aika kuluu melkoista vauhtia ja kokoajan päätät omia asioitasi enemmän ja enemmän."
1,Hyvää joulua hallitukselle ja kiitokset Suomalaisten edun mukaisista päätöksistä.
1,"Lämpimin ajatuksin,Loviisa"
0,"Talouden tila pahenee niin kauan, kun Jutta riistää kansaa ja kantaa rahat ulkomaille."
1,Mielenkiintoista...!
0,Täyttä paskaa.
1,"Olimme viime vuodenvaihteessa Tagororissa kaksi viikkoa 5. tai 6. kerroksessa, uima-allas oli samassa kerroksessa aurinkotiloineen, aurinko paistaa aamusta johonkin saakka, huoneistoparvekkeille ei aurinko paista koskaan, mutta tilavilla koko huoneiston pituisilla parvekkeilla on muuten mukava istuskella ja katsella elämää, ylhäällä on suhteellisen avarat näkymät, alhaalla sitten ei(?)."
0,Edes Branstein tai kreivi von der Goltz ei olisi tuollaiseen alentuneet.
0,"Miksi halutaan aina heittää lokaa sen maan nimissä,jonka nimi on Egypti, jossa Suomalaista turistia pidetään hyvässä huudossa, olkaamme otettuja huomiosta.Varmuudella tiedän missä mennään, olen ollut Egyptissä useimmin kuin jokin trollaaja, toivoisin jos jokin tämänpalstan trollaajista matkustaisi Egyptiin, ja sen jälkeen kertoisi tositapahtumat."
1,Mä kans joskus selailen niitä =) Mutsilla oli varmaan joka lähtöön oma sanonta...
0,"Ei kumpikaan...sä olet feikki,sua vaan harmittaa kun et pääse kenenkään naisen pöksyihin..."
0,Äläkä saatanan sekasikiö sotke tähän sivullisia.
1,"Jos eivät, niin mitä sitten, saitpa hyvät naurut."
1,"Hyvä miettiä jo etukäteen kaikki vaihtoehdot, kiitos!"
1,makee
0,ei kai turhuutta tarvitse perustella kun se kerran turhuutta on ! vastausviestisikin ovat turhia .
0,"Vammoistakin kun akat hakkasi - lapsia, joilla ei ollut niin isää kui äitiäkään - olen itsekin kuullut monenkin nuoren ja lapsenkin sanovan että en jaksa elää - ei koskaan saa surra, olla masentunut, vihainen, tuntea tunteita, ihmisten vihan kyllä tuntee omassa kehossaan - sitäkin on turha toitottaa ettei hyväksy tai ole hyväksytty - riiston maku kaikessa - ku joku kättelyssä jo ilmoittaa että mitäs sinne tai tänne oot tuppautumassa?"
1,Kiitos jos etukäteen kaikille vastaajille.!
1,Voisit vaikka yrittää tutustua muihin samalla luokalla/luokka-asteella oleviin.
0,EN OSAA KÄYTTÄYTYÄ KU OON KATKERA!
0,"Mielenkiintoista hyssyttelyä tai hyssyttely-yritystä, toisaalta aika hiljaa iporöllit on, pelottavan hiljaa"
1,Ihanaa on kyllä nytten..sunnuntaina vielä ihanampaa kun saadaan katsella leijonia kultamitali kaulassa!! =D
1,moi :)
1,"Upeaa, pääsemme viikon päästä sinne!"
0,sdp on yksi historian suurimpia huijari- ja koplauspuolueita.
1,kiitos auttajalle !
1,yst.t. jari
0,Yksi keino järkytää noita dillejä lisää.
1,MEILTÄ SAA PALVELU ja koot 36-46 myöskin 48 että ensi kerta vain rohkeasti sisään
0,"(Olen siis noin 10kg ylipainoinen) Näytän läskiltä, ja kuntoni on huono."
0,Ja jatkossa hän voi vaatia muutakin älytöntä.
0,Homot odottavat kieli pitkällä vaseelinpurkki kädessä uutta Babylonia.
1,Heippa!
0,VEDÄ VIDU PÄÄHÄS JA PAKENE VUORILLE PIKKUHOMO!!
1,kiitos vastauksesta.
1,kirjoitus ilman virheitä :)
1,Kiitti Sinulle kivasta.
1,Minusta on ainaki mukavaa kun tulee uusia tuttavuuksia.
0,"Ja mitä vittua tuo tarkoittaa, että MAT selittää todellisuutta, mutta ei ole sitä?"
1,Mutta kannatan kyllä asiaa edelleen.
0,"Monestihan paljastuu teontekijäksi joku ihan tavallinen pulliainen, ja huokaillaan sitten, ""ettei olis siitä millään uskonut""."
1,Kiitos vastauksestasi.
1,Rakel Liekin näppärä pakina...:D
1,Olenpahan ainakin yrittänyt:)
1,Haluaisin vinkkejä lihotukseen!
1,WAU!
0,Miksi saatana sentään joudun maksamaan kokoomuksen mamutus ja multikulttuuri propagandatykin ylläpitämisestä?
1,yeah
1,"Mutta tämä tie on autuas tie, enkä mistään hinnasta tätä tietä vaihtaisi pois!"
0,Kirjoittaja tuskin tulee koskaan edes perustelemaan väitettään tai jos perustelee sieltä lentää taas kilo käsittämätöntä paskaa.
1,Itsepetos täytyy kyllä tässä asiassa nostaa kunniaan!! :)
1,Sattuuhan sitä.
1,"Edelläkävijöiden , , , Rakentavalla - Postivisuudella Tiedostaminen Parantaa :)"
0,Herjaatko virkavaltaa?
1,Oikein hyvää kesää sinulle mimmi80=))
1,https://www.youtube./REDACTED/RsxXeRwPXbbA sinkkulaivan porukka oli taas risteilyllä :D
0,"Naapurit voisivat vielä varmuuden vuoksi kerätä yhteisen kolehdin ja kustantaa ""äipälle"" munajohdinten katkaisun yksityisklinikalla."
0,Naisen painon pitäisi muka alkaa 4:lla tai 5:lla (55kg kyllä EHDOTON maksimi) jottei olisi järkyttävä ameeban lailla eteenpäin löllyvä muodoton klöntti.
0,Olen ruma ja kokematon.
0,Ihmisten punaniskainen suhtautuminen on ikävää :(
0,"SIINÄ ON JUURI SE MERKITTÄVÄ ERO JA OSOITUS PRIVILEGIOISTA"""
1,Hyvä kysymys
1,Joten onneksi vaihdoin alaa.
1,"Kaiken minäkin olen joutunut oppimaan suorassa koulutuksessa, ilman yhdenkään ihmisen apua, paitsi, että minua on kohdannut niin ihana armo, että minulla on todelliset uskonystävät ja hyvä hengellinenkoti, mutta siltä olen ollut siinä asemassa, että minut on valittu ottamaan koulutus vastaan Jumalalta, ei ihmisiltä ja kuten olen kertonut, kovat olen minäkin kokenut, tavattoman kovat, mutta kauan olen saanut jo olla vapaa, iloinen ja rauhallinen ja siihen Jeesus jokaisen omansa kasvattaa."
1,"Toisaalta minä olen saanut pitää mielenterveyteni ja nauttinut vauva-ajasta kun välillä voin oikeasti lähteä esim koiran kanssa pitkälle lenkille tai kaupungille syömään kaverin kanssa, kun tiedän että isäkin voi tarvittaessa pullosta antaa."
0,"Kuulostaa siltä, että tuo ""monta kertaa viikossa"" on jumittanut kehityksesi."
0,Kylähullu pelle.
0,"Koska aina päätös oli 0 tukea vaikka olin valittanut päätöksesta melkein 40 kertaa, niin oli pakko ottaa alainoja!!!!"
1,"Kyllä sinä ihan asiaa kirjoitat, ei siinä mitään."
0,"Jyväskyläläiset ja muidenkin paikkakuntien työttömät peräkammarin aikamiespoikapedofiilit istuvat rutiköyhinä luusereina ja katselevat ulos ikkunastaan miettien, että täytyypä taas yrittää lieventää omien rikosten järkyttävyyttä levittämällä suomi24.fi:n ja muiden palstojen keskustelufoorumeilla harhaanjohtavia ja asian vierestä kertovia uutisia ja tutkimuksia."
0,hävetkää jos osaatte.
0,:D vai olet sitä mieltä että minut on jätetty kasvattamatta kun en ole huumorintajuton rasisti!?
0,"Muslimia on pohjolassa ainavaan lisääntyvässä määrin -nämä pitää tällaisia keinoja kun , rasismi Kuka näiiden kanssa voi neuvotella ."
1,"Valittaminen kuuluu elämään, sopivissa määrin :-)"
0,Hankkikaa elämäja vetäkää vaikka tumppuun.
0,"Kymmenenvuottako kärsivät puutteesta ja nälästä ,roikkuen löyhässä hirressä ja kun vihdon eläkkeelle pääsevät ,mitä on jäjellä?"
