0,"MUA ON VAIVANNUT TÄMÄ ASIA JO PITKÄÄN.HUOMASIN 13- VUOTIAANA ETTÄ JALKOJENI VÄLIIN RUPEAA KASVAMAAN JOKU OUTO PATTI.TAI,EI SE PATTI OLE VAAN JOKIN KUMMA JUTTU,VÄLILLÄ SE ON KUIN PRINSSINAKKI,VÄLILLÄ TAAS HK:N SININEN,VAIKKA ONKIN PUNAINEN.MISTÄKÖHÄN MAHTAA OLLA KYSE??!!"
0,"olisit sitten jättänyt kommentoimatta, ei sinun musiikkimakusi erilaisuus ketään kiinnosta"
1,olisi kiva tietää missä nykyään asuu ja mitä kuuluu
1,LOL.
0,"On tämä niin raskasta ja vaikeaa työtä tämä vaippojen ja korsettien, 'luennoitsijoiden', Hessun ja Jussin ja muiden, rahtaaminen Pohjanmaalle, että sitä joskus oikein jää ihmettelemään, että miksi tätäkin työtä tekee, ja kannattaako se loppujen lopuksi?"
0,Tämä ei ole Raamattupiiri.
1,Olen kokeillut recover4all-ohjelmaa ja onnistuin sillä saamaan muutaman tiedoston takasin.
0,"Nyt tämä minun sortaminen riittää tälle päivälle, kiitos!"
1,"Ajattelin, että ne ovat sopivia minulle."
1,Yksi hyvä apu vatsan ph-tasapainoon ja ruoansulatusongelmiin on Valmarin.
0,"Lueskelin noita palstan ketjuja ja täytyy sanoa, lohdutonta on, aina sitä samaa jankkausta, olipa aloitus mistä tahansa."
0,"Meillä kuulemma helvetin pitkä matka kansainväliseen sivistykseen ,Helvetin noloa."
1,ne on aivan ihania.
0,"Ensinnäkin, Adressi ei ole ensihoitajien laatima, ja toiseksi adressissa ei lue väittämääsi asiaa."
0,Mikä näitä suomalaisia spykoloogeja ihan oikeesti riivaa?
1,Ei noin tärkeä asia kuin virallisten nettisivujen ylläpito saa olla ns. lapspuolen asemassa ;)
0,Mikkeliläiset kateellisia
0,Et myöskään tunnu hallitsevan itsenäistä ajattelua.
1,"Ja Aamen on yhtä, kuin TOTISESTI!"
1,"Se on parasta huumoria :), nauramme koko perhe näille jutuille ja taputtelemme toisiamme olkapäille, kun olemme, niin muita parempia."
0,Jenkeissä majailee tällä hetkellä kaikista hyödyllisimmät idiootit maailmassa.
0,"Trolololo, jokainen tietää, että mielipiteen täytyy olla sama kuin Glorianalla tai se on kelvoton."
0,että oikeusturvaa heikennetään tavallisen kansan seläntakana ja kytät on kohta vessassakin.
0,Kehtaatko SINÄ todellakin paasata mopopojille tai jollekin muulle jotain aikuiseksi kasvamisesta?
1,"Whey Overdrive 13,8 euron kilohintaan hintalaadultaan parasta heraprotskua mitä on saatavilla"
1,Vatsa näytti jopa pienemmältä aamulla :].
0,"Eikä sekän ryyppäileminen ( syömisen edellä ), jota tavallisesti kohtuulliseksi kutsutaan, ole millään muotoa niin viatoin, ettei se vahinkoa myötänsä tuo, ehkä ei rangaistus niin pian ja niin silmä näkyvissä seuraa sitä luonnon lain rikkomista."
1,mutta kumpikaan ei tyhjä sivu :)
0,"Jos rouvalla on niin paljon aikaa et pystyy pesemään paskavaipat käsin,ekä ne edes lähde sellai kunnolla puhtaaks,ni tuu meillekki pesemään.. ja vies himaas ne kuivuu ku mulla ei niitä oo kovin paljon tilaa kuivatella sisällä..Ja sitte jos sä ainoona niitä kierrätät ni ei se saastumiseen paljon auta.."
0,PITÄS PYYHKIÄ TUOSTA..PYYHKIKÄÄ JOS JOLLAKIN ON KUMI!! kIITOS! toVOO:YÖHYYPPÄTÄR
1,"Minulla on sydän/verenpainelääkkeet ja astmalääkkeet ja E-EPA,jossa myös DHA (?) ovat o.k."
0,Inhottaa vaan kun jotkut eivät tervehdi koskaan pihalla tai rapussa :(
0,"Siksi, koska puheenjohtaja Soini ja työmies Putkonen on heidät pelotellut hiljaiseksi."
1,Älä ainakaan lopeta sitä se vahvistaa ruumista ja mieltä.
1,Onnea pikku-prinsessasta! :)
0,Ja joo päällä on joku koiranvaate ja lämpötila ulkona +5. Mikä järki edes kasvattaa suomessa koiria jotka palelee 10 kk vuodessa kun niillä ei ole kunnon turkkia.
1,Ehkä on kumminkin paikallaan pieni varovaisuus jos naapurinukko tulee hikisenä sokeria lainaamaan - voi vaikka rakastua.. ;)))
0,Senpä vuoksi nirso ja ikääntyvä nainen saakin usein olla oman asenteensa kanssa yksin.
0,"Ja voi perkele, jos se nyt sitten vielä uusiutuu!"
1,"jees joku muukin on tehnyt saman ratkaisun kuin minä,huomasin kanssa että töitä kerkee tehdä myöhemminkin kun lapset on isompia.olen nauttinut näistä parista kuukaudesta mitä olen ollut kotona kaksi vuotiaan tyttöni kanssa.oikea ratkaisu ainakin omasta mielestäni :)"
1,hyvä hyvä ei kun hanaa vaan
0,poliitikot kyrsii
0,Me rahoitetaan vaan meidän kotimaisia kalpeita kestorattopoikia.
0,Tulipa vasemmisto-älymystölle hätä.
1,Moikka!
1,Hyvä!
1,Ellei sitten 127 euron popot ole alennuksessa 89 euroa :)
0,"Miksi teette tuollaista Lokka-maista, joka herjaa Loimaalla kuollutta lasta netissä ja youtuben chateissa, nytkin parhaillaan SKe-kokouksen youtubessa."
1,"Se kuulemma ei ole kovinkaan riittoisaa mutta silti haluaisin testata, kokemukset olisi kivaa kuulla!"
0,"Menin valittamaan vuosikausia jatkuneita pahoja yhdyntäkipuja, ja vastauksena oli ""Melaa mekkoon vaan!"
0,sivusta heitetty ja hyväntahtoinen mutta onnettoman huono vitsi-yritelmä.
0,Ei naisilla sellaista ongelmaa olekaan mihin mies/miehet ei olisi syyllinen.
0,"SSO on tai oli Arvosen hiekkalaatikko, toivottavasti koirat ja kissat käyvät siellä paskalla, ja nurkkiin kuseksimassa."
0,Se oli MUN!!!
0,"Vihaan sitä ihmistä enkä ikinä voi antaa anteeksi,mutta joku pidättelee paskassa suhteessa...raskaus kai."
0,"Patjoilla ei ole valinnan varaa jos matkustella haluaa, eikö nyt jostakin maailmalta joku ukon käppänä löydy."
0,Vetäkää jojo kaulaan - minä kuolen huomenna munuaisten vajaatoimintaan!!!
0,Iskelmä on niin syvältä.
0,t o d e l l a huonoa.
1,"JA SÖPÖIN KOKO TALOSSA,,, NÄIN SE VAAN ON"
1,mukavaa lukea Sinuakin pitkästä aikaa.
0,"OLEN MONELLE HENKILÖLLE VELKAA, MUTTA EN OLE VARMA ONKO NOI KAIKKI HAKENUT VELKOJA ULOSOTTOON?"
1,Moi!
0,Surullista....
1,Hyvää vointia ja joulunalusaikaa ja mainioita metkuja UAA:n ympyröihin!
0,Tunnustelin sitä ja se tuntui inhottavalta.
0,Voi ristus mitä neuvoja anteeks vaan..
0,"tulla sanomaan, että ei mitään huolta..."
0,"Ole vaan pelkkiä saastoja kaikki joten ei mitään vahinkoa tullut, joten siitä vaan ja atomipommilla niin päästään näistä saastoista eroon lopullisesti"
1,Auttakaa suomenkielen kanssa xD
0,Siis juuri ne valittaja ja ruikuttajageenit naisten puolelta siirtyvät vapaasti eteenpäin.
0,Samojen viestien jatkuva kopioiminen on kielletty säännöissä ja muiden kirjoittajien haukkuminen (puolin ja toisin) osoittaa täydellistä tyhmyyttä.
0,itse olen eläinrakas että en paljon sympatioita voi tekijöitä kohtaan tuntea.eikun saunan taakse tuommoset................
1,Normaalisti ilman niitä Solvallan juoksuja se ois tuon lähdön vienyt vaikka peruuttamalla! =)))
1,"Suosittelen, sillä hän ainakin puhuu niin kuin profeetta."
0,"Minun kanssani ei kenenkään kannata ruveta väittelemään, sillä tiedän kaikista asioista asiat parhaiten."
1,"En myöskään tiedä, mitä uskoa lienee harjoittanut mies, joka on kotitaloni joskus kauan sitten rakentanut, mutta koti on nyt siunattu ja hyvä."
1,"Mut pääsääntöisesti hyvin on mennyt, onnea teidän ystävyydelle mihin ikinä se johtaakaan!"
1,Toivotan onnea matkaan!
0,"hahahah,toihan on tosi idioottia ooks sä noin surkea sängys ku muna ei kelpaa,etsi 90vuotias pappa se ei halua ku ei seiso terve mies haluaa aina.ku itteesä halua runkata parisuhtees ku pilluaki on saatavis"
0,keksi jo välillä sinäkin jokin muu aihe kuin tupakka..
1,Googlesta löysin hyvän artikkelin
0,Niska/pers ote ja käytävälle mahallaan liukuen.
0,psykopaattista eikö.
1,ääni annetaan klikkaamalla viidettä tähteä:) kiitos!
1,Hyvää matkaa sinulle!
0,Nytkin painaa erään hyvin läheisen ihmisen erotilanne - kaksi pientä lasta - toinen heistä vain yhdeksän kuukauden ikäinen :(((((((
1,"Pari kertaa olen rahan puolesta uskaltautunut Caperoon, jossa oli oikein hyvät pizzat."
0,Tunnen häpeää että elän samassa maassa kanssanne.
1,Mukavaa puuhastelua touhukerhossa.
1,Erinomaisen hyvin muodostunut ja treenattu.
1,"Kiitos, kiitos!"
0,"Muuttoautokin jätti pihaan ""karmeat"" jäljet."
1,"Hän on kuulemma valmis kaikkeen, rakastaa niin perhanasti, itkee ja kyynelehtii."
0,ei auta mikkään.
1,"Sekin on mulle plussaa ettei tarvi muistaa joka päivä, kunhan välillä tarkistaa että on laastari on paikoillaan."
0,jep jep.. kyllä se poliisi osaa todisteet hommata ja jos ei muuten löydy niin sitten tekevät itse..
0,Esiintyisit sinäkin vaan reilusti omalla nimelläsi niin sinut otettaisiin paljon vakavammin näissä keskusteluissa.
1,"tutunlaisia ajatuksia, mukavaa kesää sinulle."
0,"VItut, ainoa suppea ja tökerö on sun aivos!"
0,Ette te saa muuta aikaa kuin huudatte vaan lisä mamuja ja Mamuilletalp lisää tukia.
1,Aamen!
1,"Vaikka joidenkin rakkaus näkyvästi kylmeni, minulla on hyvä olla."
1,oli hyvä vertaus.
0,"Hänellä on lähipiirissä joku, jonka puhevikaa on myös kiva pilkata, itse ollessaan täydellinen....k-pää"
1,Ei kun uutta vaan etsimään!!
1,Kiitos jo etukäteen.. =D
1,Saa toki kysellä lisää jos kiinnostaa :D!!
0,Ei tätä jaksa lukea enää Erkkkikään.
0,"Nettideittailu ei sovi mulle, kun en ole mikään missi eli en näytä valokuvissa hyvältä."
0,"Islam ei tunnusta ihmisten tasa-arvoa, eikä sananvapautta."
0,Sori vaan.
1,helppoja töitä kun vaan pääsis auton alle:)
0,Olen samaa mieltä hcd:n kanssa että aloitit tuon rönsyn asiattomalla viestilläsi.
1,Kyllä on mahtavia kirjailuja nuo!
0,Kohta tulee itku...
1,Oli taas mukava katella ku Turkulaisilla lakaistiin jäätä Helsingissä!
0,"nyt kun tuohon pääsin, suoraan sanoen vituttaakin kaikki mukahurskaat kerettiläiset raamatun tulkitsijat."
1,;-)))
0,"vähän järkee kirjotuksiin, kiitos."
1,Niinkö meinaat ;) pääseekö myös viekkuun nukkumaan?
1,-Kiitos! :)
1,"sen, kurkkujuustovoikkarit ovat valmiita syötäväksi nam!"
0,"Onnekseen ovat niin tyhmiä, että eivät sitä ymmärrä ja jatkavat vaan."
0,HUONOJA PUOLIA:
0,Kaiken huipuksi kela tukee tälläistä toimintaa veronmaksajien rahoilla.
0,ostat uuden töllön kun vanha töllö hajoo??
0,Kukahan tämä uhri oli..? :(
0,"Se johtuu kai siitä, että lutkuttavat kullia 24/7."
0,"Pelkään: Että tulevaisuus ei ole valoisa minulla ja läheisilläni, vaan menee entistä huonommin."
0,"Mä en vaan jaksa sen kanssa alkaa vääntämään, sitä varten sossut on olemassa, että ne ajaa lasten asioita."
0,perehtykää asioihin turhan hölinän sijaan
1,Onnea vain uudelle kulkupelille!
0,Jos ei niin kannattaa katsoa kenen kanssa lisääntyy!
0,Selkärangatonta.
0,ei lähde nukkumalla:( eikä malttais nukkumaan mennä jos vaikka... vaan eihän se niin oo.
0,No voi jestas.
0,"Omaiseni kuuluu Ruoholahden kotisairaanhoidon piiriin, mutta ei saa sieltä mitään apua mihinkään."
0,*irvistys*
0,"Sitä vain on elävä kuollut, jonka elämällä ei ole enää mitään arvoa."
1,"Voi Seppo raukkaa, mahtaa hänellä olla rankkaa :( no mutta eiköhän katariina kohta pelasta hänetkin :) jos Lari otti Kallen huoneen käyttöönsä niin Sepollehan jää vielä Eliaksen huone"
0,BOOOOOOOOOOOOOOOOOOO.
0,"Tämä lista se vasta pitkä olisikin, vaan miettikääs tuomitsetteko tällaisen otuksen (en kehtaa kutsua mieheksi, saatikka ihmiseksi)."
0,VITUN AIRFINLAND
1,"Tottakai, näen hänet aina kun katson peiliin ;)"
1,Mutta voin myös olla hyvännäköinen ja onnellinen:)
0,"En enää tuosta välittänyt tai uskonut tuota, koska olihan mies kotona, mutta kiero ja tuon tapaisilla uhkailuilla on saanut uskomaan ettei edes kannata lähteä käräjille."
0,Sinulla Maximi Miikkulainen on syntiä ja fariseuksen harhaoppia ihan selkeästi.
1,"Ei niin, ettenkö Itsekin pitäisi hänen kappaleistaan, mm. ”Evening Falls” ja ”Orinogo Flow”, jotka löytyvät YouTubestakin."
0,toivon ettei sinulle toista lasta koskaan siunaannu kun tuosta vaan voit todeta ettet ensimmäistäsi kohtaan mitään tunne.
0,tietysti jo mennyt pois...Ritarilla ei nyt mee hyvin...:(
0,Miksi ei voida jutella:(
0,Auta mua!
0,"En opi ikinä kun vasta kantapään kautta, jota haluaisin tämän keskivahvan päihteen kanssa vältellä, joten pyydän tosissani apua ongelmaan."
0,En tunnista tätä maata enää samaksi kuin muutama vuosi sitten.
1,Kiitos!
0,"Niin minä olen sitä mieltä, että hän (Tuomas) on vain yksinkertaisesti niin tyhmä jätkä, ettei hän tajua sitä ettei hän osaa soittaa paskan vertaa."
1,-Ja vatsa kiittää! :)
1,Kiitos!!!
1,"Nainen itsekin, mutta onnellinen."
1,Hyvä !
0,"Tätä kirjoittaessa pentu teki lätäkön sille ainoalle matolle, mikä meillä vielä on lattialla...siirrynpä taas siivousosastolle..."
1,Ihan upeaa ja toivoisin että itselläkin olisi lenkkikaveri vaikkei ymmärtäisi tilanteesta mitään.
0,Nyt myöhemmin jollain tavalla harmittaa jos nuo joskus osoittautuvat todeksi.
1,minusta duudse on mahtava nimi.:)
1,Kokeilkaa!
1,"Suurkiitokset vastauksista =) Markkinoita vielä mietiskelin, että mistä löytyy ja minä päivinä?"
1,Kiitos!
0,no ei helvetis tarvi piuhoi repii
1,Treeni kulkee ja muutenkin näyttää ja tuntuu hyvältä.
0,Ja onhan sanakirjoja jos ei ymmärrä ?????
1,Vaihdoin vielä tilauksen jälkeen haalarin kokoakin sähköpostilla ja sekin onnistui.
1,...aivan totta!!
0,Uuden mieheni omaisille suunnattu minun haukkuminen suututti todella.
0,"evouskovaisesta: ylimielinen, pilkallinen ja suhtautuu ivallisesti pieneenkin kritiikkiin, jota hänen uskoaan kohtaa esitetään."
1,tulemme mielellämme lukemaan juttujasi täältä:
1,Minä tarjoan ja reilusti.
1,Mukavaa pakkasen aurinkoa Sinulle!!
1,Antaa lisämotivaatiota :)
1,tässä hyvää vanhaa: http://www.smutfun.com/model3479/olderxxx3.htm
0,"Sitten on toinen laji käytetyillä Audeilla ajavat kammatut pikkutytöt...eikun pojat ,poikaset."
0,Suomi on luonnevikaisia appivanhempia pullollaan.
0,Venäläisen divisioonan koko taitaa olla tälläkin kirjoittajalla ihan hukassa.
1,Kahvinjuonti on terveellistä puuhaa
1,"Mitäs sitä söis, affenta ei joka päivä, hernetsubua pitkästä aikaa, jepjep:)"
1,Kannattaa kokeilla!
1,Mutta olen onnellinen suhteessani mistä en enää halua eroon mutta epävarma mutta rakastettu.
1,"you're blowing my mind, sister. :-D"
1,"Monet pelkää etukäteen, mutta se itse synnytys on niin huumaava kokemus ja lapsi niin toivottu ihme, että ei siinä ennätä edes miettiä kaikkia kamaluuksia, vaan tilanne vie mukanaan!"
1,Molemmathan siitä hyötyvät.
1,Onnea matkaan!
1,Olen tällä hetkellä tyytyväinen:)
0,Tänne on kauhean
0,Ara on kelvoton päävalmentajaksi jos se ei laita sitä kotikisoihin ykkösveskariksi.
1,-ystävällinen
1,Elämästä tulisi kuitenkin täydempää.
0,"Älä muuta viserrä, samaa olen minäkin ihmetellyt jo vuosikausia."
0,Kaksi kuoli Teivon tiistairaveissa!!!
0,--- kuinka itseään sivistyneinä pitäneet saattoivat mennä sellaiseen ansaan+????
0,"Järkyttävät sivut, ei voi muuta sanoa."
1,"Ite ainaki oon edellisis suhteis aina aluks sanonu jtn tyylii: ""oot mukava :)"" ja tommosta, kannattaa eka sillee puhua sille mukavia ja sit kehuu sitä, jos seki kehuu sua, nii todennäkösesti se on ihastunu ;)"
0,"Uudemmista autoista ehdoton surkki oli Moskvista Pajero maasturi, jonka ostin ""uutena"" (rahoitusyhtiö oli hakenut omansa pois ja ostin rahoitusyhtiöltä), täysi p##ska koko auto, useampi vaihteisto meni takuuseen, runko takaa poikki virheellisen vetokoukun kiinnityspisteen vuoksi ym. ym."
1,kiitti! :)
0,Eläimiä on kuollut sukupuuttoon...
1,Noh tuskin pitkälle tässä maailmassa etenee :)
1,Syö pikaravintolassa niin siellä on rasvaista ruokaa nii varmasti lihot!! :)
0,"Itse en haluaisi tanssia samankanssa koko iltaa ,se on tylsää ."
0,"Voi sinua onnetonta, et sinä pysty määräilemään minua pois täältä, ikävä kyllä."
0,Stiller on mitätön vajakki joka ei olisi koskaan päässyt telkkariin töihin ilman holokaustikusetusta.
0,Fasisteilla ja Komukoilla opit on samanlaisia.
1,"Asiaa ei helpota myöskään se, että oppilaitos on reilu 200km päässä, joten joku majakin ois tietty mukava, JOS se paikka sieltä irtois :D"
1,... verona se kelpaa mainiosti.
0,Anna kakara pois
0,Haluammeko me tätä?!
0,Tosi sairasta:
1,Hyvää jatkoa teille kaikille.
1,Siksi minusta olikin virkistävää nähdä hyvin muotoiltu ajatuksesi näistä kysymyksistä.
0,"Miksi ihmeessä joka mökissä pitää olla oma traktori, oma leikkuupuimuri ja paljon sellaista kamaa, mitä käytetään vain sillointällöin?"
0,ovat kaikki keskenkasvuisia kakaroita ja tuskin piittaavat mistään järkevästä viestistä.
1,"....vasta tuolla viime vuoden puolella, kun kuulin laulun Oikeesti - Finlandersin...:))) Siitä lähtien hulluna kuunnellut Iskelmä musiikkia."
1,Suosittelen
0,"Liian nuorekas, siis teinityttömäinen pukeutuminen naisella yli 50 näyttää naurettavalta, napapaitoineen ja puoleenvakoon ylettyvine farkkuineen."
0,No haloo!
0,Pienet lapset joutuvat kärsimään äidin virheen ja isovanhempien luonnevikojen takia.
1,Kuten loppujen lopuksi myös käyttäjän terveyden kannalta parempi vaihtoehto.
0,Työläisten mahdollisuus äänestää porvareita ja persuja pitäisi estää lailla.
0,....
1,"Mopon vuokraus n. 150 batia per päivä, siellä on erittäin turvallista ajaa, tie on suora ja leveä, mopoilijoille on varattu omat reunat tiestä."
1,"Ensi kesänä sitten kokeilen työnhakua uudestaan, ehkä sitten onnistuu paremmin :)"
1,Kiitoksia vinkistä..
1,Kiitos asiallisista vastauksista.. =D
1,Suuret kiitokset tämän mahtavan tapahtuman järjestäjille!
0,"Mulla on kuule ollut yli viiskymppinen muija ja silläkin on alapää tiukempi kuin sulla ja ymmärsi miestä, antoi aina kun pyysi."
0,Minä en laita yhtään mitään enkä hössötä.
1,Rakastaa ja on lempeä ja tralalaa.
0,Joskus harmia jopa ihan aidoille narsisteille.
0,Ja mies suuttuu mulle kun en hänen rakasta muoriaan jaksa miellyttää!
0,Eivät naiset ansaitse mitään palvontaa ja tavoittelua osakseen.
1,Harun talli on kyllä hyvä! http://harunhevostila.nettisivu.org/
0,"Tmt-asiakas taas maksaa vuokransa tunnollisesti, ja jos vuokranantaja on täysin paranoidi hullu tai sosiaalirasisti, voidaan sosiaalitoimen kanssa sopia, että vuokra maksetaan suoraan vuokranantajan tilille."
1,"Kouluttauduin kaikesta huolimatta naisvaltaiselle alalle, koska sen sisältö houkutteli ja tuntui omalta."
0,"Tässä se nyt nähtiin, Täällä meidän lintukodossa piilotellaan asioita, Ai ai, ja Kokko haluaa lisää kavereita tänne, Mites se suu sitten pannaan kun rupeaa tapahtumaan, Ollaan kaikki kysymässä neuvoa Kokon oven takana??"
0,Hyvähän sinun on hulluista kirjoitella kun itse omaat siitä paperitkin mutta minkä pelin näistä lasket SaPkOn voitoksi?
0,MIksi he puhuvat sellaista johon itsekään eivät usko eivätkä noudata omia heuvojaan. :-))))))
0,"Ei se vaihtanutkaan parempaan, luuli vaan..."
0,LAINAUS PÄÄTTYY
0,"Nyt juuri on ollut muutaman päivän ajan lievää pistemäistä kipua ja tänään teki parin tunnin ajan tosi kipeää, oli melkein vaikea kävellä kun piti koira viedä ulos, tuli jopa hieman huono olo, mutta nyt on taas helpottanut."
1,Yhdyn edelliseen!
1,"Tsemppiä vaan, kyllä se sujuu..."
0,"Oman lapseni isä tappoi itsensä alkoholisoituneena maksakirroosiin jo 30-vuotiaana, joten kukin voi mielessään miettiä mistä ne roolimallit on paras ammentaa; onko välttämättä se lapsen biologinen isä se paras mahdollinen malli?!"
0,"siirretään mieluummin Jaalaan koko vitun palokunta, sieltä on lyhyempi matka Heinolaan sammutustehtäviin.(hei, se oli vitsi, pakko kertoa ettei joku idioottipäättäjä vielä teekkin niin)"
1,"Aihe ei nyt tosiaan ole mitään kirkon erityisalaa, mutta kun kukaan ei ollut vastannut :)"
0,Ei helvetti.
0,Mummoja ja muita munahaukkoja me välttelemme.
1,"Kanta-asiakas: Hienoa, tuokaa minulle tomaattikeitto ja lasku."
0,Minäkin olen ollut työvuokrausfirman nussittavana joskus.
0,Ja varmuuden vuoksi synnistävät pieniä puolustuksen kyvyttömiä pikkulapsina.
0,Taas pökälehdit näköjään palstalla.
0,pahasti hukassa demokratia venäjällä ja kiinassa.
0,Tämä oli kuulkaa tässä.
0,Misriparka nyt ei kyykytä muita kuin korkeintaan itseään.
1,"Toivottavasti vielä joskus pääsisin Puijonlaaksoon asumaan, yliopiston ja latujen väliin - ja vielä olis aikaa käydä hiihtämässä ja perehtyä suksien voiteluun opiskelujen lomassa."
1,Hienoa!
1,suurin silmin minä neitosta katselin iltaa istuessaan makuu huoneeseen sitten minä astelin neito lempeä mukanaan
0,Pahoin pelkään ettei tavikset sinne pääse millään keinoin.
1,Tyytyväinen olen kun on työtä ja harrastuksia.
0,"Ja taas kerran saadaan kansa jupisemaan seuraavat 4 vuotta, että seuraavaksi äänestän kyllä jotain muuta."
0,"Minä kyllä yritin lähestyä häntä, mutta ei hän huolinut, en ollut ilmeisesti tarpeeksi nätti tai rempseä tai tai tai..."
0,On säälittävää ja surullista nähdä miten asiat nykypäivänä ovat maailmalla ja elämissämme.
1,Haluaisin edes yhden päivän olla rakastettu ja arvostettu!
0,"huh huh! noita vanhan naisen unelmia, ""aloitan tyhjästä yksin"" eiköhän olisi paras jos hakeudut ammattiauttajien pariin ja hoidatat masennuksesi ensin ja sitten alat miettimään mitä tekisin sitten ""isona"" hahahaaa!"
0,Pesä saatiin lopulta jakokuntoon ja jopa käräjäoikeudessa vahvistettua mutta leski pääsi vielä väliin sähläämään joten tuli 6 kk valitusaika joka umpeutui nyt maaliskuussa.
0,Yksilöitä on palstoilla ja he koettavat kylvää epäuskoaan ja vihaansa kristillisiin asioihin.
0,Hyi helvetin
1,Päivitänpä tilanteen: Sain ihanan soluhuoneen!
1,"Pressanhan ei tarvi nykyään muuta kun käydä ulkomaanvierailulla kertomassa, että tällainen pieni valtio kuin suomikin on olemassa :=))) Mä tykkään matkustelusta ja reissuilla sais syödä eksoottisia ruokia ja ennen kaikkea juoda varmaan kunnon laatupunkkujakin :=)))) Että miten se on?"
1,Port Aventuraan kannattaa ehdottomasti mennä ja mielummin kahdeksi päiväksi että kerkeää kunnolla hurvittelemaan.
0,"niin tai nain,mutta soten pelkka valinnanvapaus on syvalta vailla jarkea."
0,"Köyhät on lyöty kyykkyyn, ne on tuolla leipäjonoissa."
1,"se on tietysti ihan makuasia ja voipi hyvinkin olla, että jo muutaman kuukauden päästä yllätän itseni punaviinilasin äärestä haaveilemasta:)) (toki siinä lasissa voi olla muutakin kuin punaviiniä...)"
1,"Päätin kotiin päästyäni käydä kaikki vaatteet päällä kylpemässä, tunne oli ihana."
0,VIINASTA EN TIETENKÄÄN SANONUT HALAISTUA SANAAKAAN !!!
1,Minulla on kiva kaveri joka viihtyy iltaelämässä myös.
0,Teillähän asenne on kohdallaan!
1,Minäkin suosittelen avointa suoraa keskustelua hönen kanssaan.
0,Täällähän se varmaan selviää..voi kristus että on löyhäpää vapaana!
1,Voi tehdä hauskoja juttuja ilman monimutkaisia järjestelyitä.
0,Että etköhän sä ilman kikkeliä pärjää päivän-pari!
0,Just joo.
0,SE TUHOAA AIVOT JA TAPPAA!!!!
1,"Itse asiassa pystymetsäläiset ja kruunuhakalaiset on ihan yhtä hyvää jengiä,ei tee tiukkaa."
0,Turhaan toivotan
0,Ei todellakaan.
1,"Itselläni oli tapana nakata joukkoon vielä (Ehrmannin) rahkaa lisäproteiinien vuoksi, mutta jos muutenkin syöt proteiinipainotteisesti niin hyvä niin."
1,Selkeää tekstiä on helppo lukea.
0,Viimein mieheni jäi kiinni että petti minua tumman naisen kanssa.
0,"Ota opiksesi äläkä tuhlaa tyhmyyksiin aikaa, elämä on liian lyhyt siihen."
0,"jakomielitautisi vaatii nyt oikeasti hoitoa,"
1,"Mutta aivan kuin sanoit, minä on olen minä ja onnellinen siitä."
1,"Todella monipuolisesti pääsen melkein kaikkia soitettavia lajeja tanssimaan, tiedoksi vaan."
0,Tässä näitä asioita eri näkökulmista pohdittavaksi ei riideltäväksi!!
0,"Ratti.fi, tämä opetuslupaopetuksen Tinder ;) yhdistää ammattimaisen opetuksen ja ""amatööri""- opetuksen HUONOT puolet - amatööriopettajan ja ammattilaisen käyttämän tuntimäärän"
0,muut pelit toimii hyvin muttei tuo.!!..
0,Akrobaatit älkööt vaivautuko vastaamaan.
1,millanen kaktus on appi-ukon pallit :)
0,Ja nyt sitten ihmetellään että miksei hesari kirjoita kunnolla...
1,siis -74 tai -75 :D
1,HYVÄÄ ITSENÄISYYSPÄIVÄÄ
0,Jäi susta sieluuni syvä haava...
1,Ainakin yksi K-alkuinen sopisi vallan mainiosti kuvaukseen :)
1,"Rakennuksen kunto ei ole kehuttava, mutta lapset ovat maalanneet seinille iloisia kuvia."
0,"Tietenkin sitä voi työkkärissäkin roikkua ja mielistellen käydä 8 kertaa saman ""miksi en saa töitä kurssin""."
0,"Söin aikaisemmin masennuslääkkeitä ja silloin nämä ajatukset eivät häirinneet niin paljon, mutta kokeilin lopettaa ne ja ajatukset alkoivat taas ahdistaa."
1,Antoisia pelihetkiä teille!
0,Kannattaa Mattila sunkin laihduttaa että saat noi posket oikeen väriseksi.
1,"Parempaa lattiaa et makkariin saa, kuin korkki."
0,"Yksi ryhmä jota hylkäävät armon,ovat ne joilla on nämä naurettavat säännöstönsä, itse keksityt, ja isiltä perityt."
0,"Mutta jotkut tosin vievät alle 2-vuotiaan esikoisen virikehoitoon vaikka olisivatkin terveitä itse, ei siis mitään järkeä koko subjekt.oikeudessa!"
0,Olen päätynyt aborttiin ja oli aika ikävää kun lääkäri syyllisti minua päätöksestäni.
0,Nolottaa...
0,Miten kestit 28v?
0,HEILLE ON LEVEÄ PORTTI HELEVETTIIN PÄÄSEMISEN HELPOTTAMISEKSI AVATTUNA.
1,AWA ON IHANA!AWA ON IHANA!
0,se lääkäri ensinnäkn on välillä vähän hutilo ja se vihlonta... yääähhh.. hirveetä!!
1,"Mieheni on aivan ihana, rakastan häntä aivan liikaa voidaksemme erota."
0,"Nämä tyypit ovat mielisairaita, rahan orjia."
1,Hyvä!
1,kaksi päivää oon tällä hetkel laihduttanut ja olo on mikä parhain!
1,Nyt tuli europarlamentarikolta asiaa!!
