0,Kyllä ihme olisi jos persut ei Suomessa olisi vaalien ykkönen sillä niin hävitöntä politiikkaa ovat muut puolueet harjoittaneet
1,Tulkaa katsomaan Sims 2 -pelistä ja Sims 4 -pelistä tykkääjät!
0,Törkeää!!!!
1,Kiitos!
1,Tämä oli tosi hyvä tietää!
1,"♥ Minusta tuo on aivan upea video! :)"""
1,Öitä;D
0,"Ruotsalaiset ovat kiittämätöntä siipeilijä kansaa, kun eivät halua muistaa sitä, kuinka suomalaiset auttoivat ja kouluttivat ruotsalaiset elämämisen alkuun täällä Suomessa."
0,"Isäpuoli oli muutenkin aikamoinen despootti, kaikki tehtiin hänen halujensa mukaan."
0,Nyt odottelen paksunsuolen syövän leikkausta ja kivut pahenevat koko ajan.
0,"Okei tottahan se on, mutta modernimpi versio realistisempi ja se kuuluu näin: se mikä ei tapa, se vituttaa!"
0,Äläpäs valehtele tai minä kerron joulupukille.......†
1,LOISTAVA
1,Oli aika iloinen.
0,"Ja samapa tuo, olen ollut tekemisissä niin sairaan miehen kanssa että mua ei yllätä enää mikään."
0,Ilman ystäviä ja rakkautta elämä tuntuu niin käsittämättömän pahalta.
1,Toistaiseksi vain pelkkää hyvää sanottavaa!
1,Hyvää joulua
1,Mutta se ei ollut turhaa koska kotona oli nähtävästi juteltu ja pojista tuli tämän jälkeen kavereita ja käytiin jopa toisten synttäreillä vielä koulussakin.
1,"Ei mua ainakaan niissä heti tyrmätty ""pahasti"", joten uskaltaudun enempikin tänne skriivaileen, vaikka olenkin ala-ikäinen tällä palstalla :))"
0,Maku on Suomalaisempi kuin yksikään suvakki!
1,on ne jutut aina niin hyviä kyllä että kannattaa lukea.
1,Olen työtön ;)
0,kepu pimittäjä taas laulaa koulus opetettua sontaansa.
0,"noin kuuluisalla TV-Julkkiksella on eri vapaudet ,kuin meillä taviksilla!!"
0,"Tätä on kestänyt puoli vuotta, soittelee päivittäin, tuntuu keksivän aina jonkun syyn miksi voi soittaa."
0,Toisekseen olen todella neuroottinen sukupuolitautien suhteen varsinkin kun edes kondomi ei suojaa niiltä täydellisesti.
1,Mutta kirkko tekee erinomaista työtä tälläkin sektorilla.
1,Melko tyytyväinen=
0,"PS. SITÄ SAA, MITÄ TILAA."
1,Kyllä pitää.
1,Siinä sitä on kummitukselle taakkaa kerrakseen;))
0,oot vaan kateellinen.
1,"Hienoa, olet asian ytimessä!"
0,Kun katselee eduskuntaan valittuja eri aikakausina edellisen teorian voi pistää ainakin osittain roskakoppaan.
0,"inhoon itseäni ja ihmistä, jonka kanssa olen koska hänen kanssaan olo tekee minusta erilaisen."
0,"Lol questeja tietenki -.- jos kerran kuussa tulee lvl kannattaa lopettaa oon vetäny enha shammyn niin, 2 päivässä 60-69"
0,"Luulisi,että tuossa edellä mainituissa olisi kaikki paheet,mutta esim.Nestlen toimesta vesien riisto maista on pöyristyttävää,eläinkokeet/ihmiskokeet, lasten/nuorten pakko olla tietyissä maissa prostituoituina,Sademetsien puiden hakkaaminen,Tupakka-kasvien viljeliöiden rahapulat ja esim.keuhkosairaudet,lapsityövoima,delfiinien teurastus &amp; pakottaminen huvinäytöksiin, koulukiusaaminen,köyhien maiden huono koulutus tai sisäelinkaupat."
1,ja tilastoissa joita pidetään niin näyttää hyvältä..
0,"Joko vihdoin terroristit lopettavat älyttömät päättömyytensä panttivankien päiden leikkaamis-videoineen, joita tämän palstan pro-terroristit ovat tietenkin pitäneet ""rohkeiden vastarintamiesten"" sankarillisuuden osoituksina?"
0,"no makuasia tietysti, mutta omasta mielestäni se on ihan luvattoman veltto."
0,"Ja kaiken huipuksi kehtaa vielä kiristää tyyliin ""mä olen sit petetty ja jätetty""."
1,Akin juttuja kiva lukea.
1,Ei oo tapahtunu mitää =)
0,Ei ne siitä mihinkään muutu sama paska jatkuu kotona.
0,Perustelusi ovat täydellisin tietämättömiä ja asenteellisia.
1,hyvä...
0,"Toinen vaihtoehto tietysti on, että uskonnolliset harhat pakottavat uskomaan, että saatana on ne sinne kiveen hakannut."
0,Taitaa tulla normi kevät Kouvolassa TAAS.
1,Tutustuin puolisen vuotta sitten yhden harrastuksen parissa mukavaan tyttöön.
0,Sillo ku aloin hoitaa sitä nii se oli iha seko eikä kuunnellu yhtää.
0,Jopas sitä on Tepi-boy pahasti sekaisin viikon Alppi-tourin jälkeen et sillei hei!
1,"suosittelen kääntymään hammaslääkärin puoleen tai purenta fysiologin.ilmeisesti sinulla on leukanivelen välilevyn pullistuma tai jokin muu vastaava mut hoidoksi yleensä on oireiden lievityksee purentakisko joka on akryylista tehty ""kisko""vähän niinkuin hammassuojat jotka on tehty juurin omiin hampaisiin sopiviksi hammasteknikolla."
0,suhteessa miehet hyväksikäyttävät naisia seksuaalisesti ja
0,Se on hyvä syyttää muita siitä ettei itse ottanut asioista selvää rahapulassaan...
1,Ne tuli takasin n. 5 päivässä!!!
0,Siitä tulee niin infernaalinen darra ettei mistään!
1,Olet hyvä ja rehellinen mies.
1,Kaikki kunnia kaikille ystävilleni!!!
0,En tiedä itkeäkö vaiko nauraa...
1,Barbie dolls must die! :DD
0,"Itseeni sattui aika paljon eron tapahtuessa, olisin kaivannut kaverien seuraa mutta kaveritkin sitten ennemmin hengasivat exäni kanssa kuin minun."
1,Toivottavasti löydätte keskusteluyhteyden ja mies tulisi järkiinsä:)
0,"Miehet ei ainakaan taida ymmärtää, että naiset ovat mielummin yksin tai satunnaisseksisuhteissa, kuin parisuhteessa tylsän ja mitättömän miehen kanssa."
0,"Tämä homoylistäjien toivemaa, mites muuten?"
1,Se on oivallinen oppikirja kunnallispoliittisesta kähminnästä.
0,Ki**i*i!
1,Kiitos!
1,Vain pienen vähemmistön mielestä silarit on ne täydelliset tissit :DD
1,soini pisti rkp:n kyykkyyn 6-1:)
1,Tässä iässä kaikki on niin kaunista jopa naapurikin:))
1,Tervehdys!
1,"* Varmaa on se, että Hän rakastaa jokaista tasapuolisesti, sukupuoleen katsomatta, sillä Kristuksessa ei ole miestä eikä naista, kaikki on Hänessä yhtä, Pyhän Hengen siteellä yhteydessä Päähän, Johtajaan."
0,"aivan sama sitten se että jotkut valittaa omista siwoistaan tuohon sävyyn, muutenkin tuo kuulosti niin lapselliselta lässytykseltä.."
1,Onnea vauvasuunnitelmiin!
1,Tsemppiä vaan ja toivottavasti lievä pahoinvointi menee ohi.
0,"Säälin ihmisiä, jotka perustaa elämänsä johonkin soopaan (OMASTA MIELESTÄNI), senkin ajan ne ihmiset vois käyttää johonkin todella hyödylliseen!"
0,Member kannatta prkl vie hankkia!
1,Kiitos rabortista!
1,"koneen suljettuani samlla unohdan kaikki höpinät, hauskatki paltalla, joten mikää ei rasita mun mieltäni sen pitempään,,,"
1,"Jutut luistaa ihan hyvin, mutta muistan kyllä pari syvää haukotusta. :D"
1,Metsästys Suomessa on halpaa ja hienoa kiitos meidän lainsäädännön joka mahdollistaa sen lähes kaikille.
0,Näin ainakin Hitler olisi tehnyt.
0,"Luuletko todellakin, että ainoat, jotka ""Komean"" Miehen jutuista herneytyy, ovat lihavia??"
0,En tiedä mikä tässä on näin vaikeaa kun en tavallaan uskalla ottaa koiraa jos en hoida sitä hetken päästä ja se annetaan pois.
0,Ja ei enää yhtään elintasopakolaista nautiskelemaan kustannuksellamme maahamme.
0,"Mistäköhän johtuu, että karvarintaisten (kultakoru karvojen seassa) ja karvaranteisten etelän miesten ääni on todella usein naisellisen kimittävä?"
1,Minun silmään ihan yhtä nättejä kuin aina ennenkin.
1,Kiitos heille jotka vaivautuvat lukemaan ja antavat minulle hieman apua pulmaani. :)
0,Kannattais teiänkin maailmansaastuttajien opetella olemaan levittelemättä niitä haaroja
1,"Nauruterapia on erittäin tarpeellista aika ajoin, sen olen myös kokenut :))) Joku joka vetää vaik korvasta sieltä ojasta kun.."
1,"joo minäkin haluisin ne nähdä :o))) Mahtavat olla erikoisia, enpä ole aiemmin törmännyt.."
0,"Yksinkertaisesti siitä syystä uskonnot ovat hölynpölyä, että uskonnollia oppeja ei voida tieteellisesti osoittaa oikeiksi, mutta hyvin monet voidaan todistaa vääriksi."
0,Häpäiset Luterilaisuuden senkin pallikarva
1,"Hienosti on koulutettu, palkittu ja ympäristöäkin suojeltu, lisäki asiakastyytyväisyys sen kuin nousee:-)"
0,Venäjä ei ole sellainen kehitysmaa että venäläisnaisen pitäisi toimeentullakseen muuttaa toiseen maahan taviksen vaimoksi.
0,On meinaan kauhea tauti.
1,Ainoa edes lievästi järkevä ehdotus.
0,Taitaa hilkkaa kuitenkin vähän harmittaa ettei enää ole valtion virka-auto kuljettajineen odottelemassa kun rouva vie ystävättäriään oopperaan tai kokkareille.
1,"**Tämä on hyvä!!!"""""
0,Eiköhän työllä ja materiaalilla täytetä henkisesti köyhää elämää ja mielikuvituksen puutetta.
0,"Kummalla on enemmän järjen valoa, uskovalla kristityllä tohtorilla vai hädin tuskin amiksen 1. luokan kahlanneella teinipojalla, jonka täytyy mennä massan mukana kun on coolia diivailla järjellään vaikkei ole oikeastaan mitään sanottavaa, eikä perusteluja."
0,Ihan outo lässytys.
0,Ja miksi olisin kateellinen pahasta ruuasta???
0,"Katsokaa minua kun minä olen nätti, se ainoa naisen asia, mitä ei ole miehille suotu (eikä kaikille meistäkään)."
0,"nähtäville, jotka osoittaisivat edes jotain väitteistäsi vähäisemmästä suoritintehosta Linux-koneissa."
1,"vaparit eivät ole niin tiukkapipoisia kuin sinä,uskon että kelpaat jäseneksi tuollaisena kuin olet;)"
0,"mites sitten torttupäiset muka-aikuiset finninaamat, jotka keuhkoaa ja nostattaa omaa verenpainettaan näiden provojen takia?"
0,Pulu on oikein katkera
0,Pikemminkin pahaa.
1,"Laiskuudesta johtuu, että kynttilät säästyvät;)"
0,"No, minä olen (myönnän sen jo itsekin) tyhmä ja liian kiltti ottaakseni eron miehestäni, joka on alkoholisti ja sen myötä unohtanut minut ja lapset melkein kokonaan."
1,Iloa elämään.
0,Ja tohon ei kyllä usko Erkkikään!!!!!
0,Harvoin näkee noin monta kirjoitusvirhettä yhdessä viestissä.
0,Onko ne henkisesti vajaita?
1,"itellä on lasit, mutta ihailen paljassilmäisiä naisia,"
0,"Se on uskomattoman törkeetä, jos se pitää paikkansa."
0,"Mutta totuus on, etten kyllä usko yhtään mihinkään enää."
0,Alkaa hermot meneen ku avomies nalkuttaa jatkuvasti joka asiasta...
0,"itse yritin sitä osastolla ja viikon päästä aloin katua päätöstäni,jonka vuoksi lähdinkin pois kolmen viikon jakson oltuani,kilon lihonneena.."
0,Ei yhtään lausuntoa mediaan ainakaan 2-VIIKKOON!?
1,"Mä uskoin meihin, todella."
1,"No, eipä ole kyllä näitä tarvinut tähän mennessä miettiä :D"
1,Onneksi huumoria ei sentään oltu unohdettu ja tervettä itsekritiikkiä ja sarkasmia.
0,"Näköjään tämä aihe sai taas kaiken maailman pilkun nus... varpailleen, kun kouluttamisesta tulee puhe, koirat tottelee muuten hyvin mutta tää autossa haukkuminen ei jostain syystä mene päähän (siis haukkumisen lopettaminen)."
0,Ahneella on paskanen loppu.
0,"En voi käsittää miksi miehet syyttävät aina naista miehen vioista esim. jos mies valehtelee ja nainen uskoo sen = naisen vika, jos mies lyö = naisen vika, jos mies pettää = naisen vika, jos mies raiskaa = naisen vika jne."
0,"Kroppa on niin pilalla eikä toimi ilman huumeita joten niiden hankkimiseksi käytetään kaikkia mahdollisia paikkoja hyväksi, kristillisiä ja muita helposti säälittäviä puheita uskovia, pummataan heiltä rahaa ja tavaroita ja myydään jopa annettu ruokakassi kaupan edustalla, että saadaan huumeisiin rahaa."
0,"Tuo on kikka, jolla uskontosi saadaan vaikuttamaan hyödylliseltä."
0,"Tai sitten juntteja jotka ei osaa lukea :-))) Eli omatietokone-&gt;c:n ominaisuudet näyttää 2,5gt."
1,Exänsä kanssa oltiin niin paljon enemmän yhdessä ja minä olin aina se tärkein.
0,Idiootit teinit sivulta pois.
0,Tympeä Matti toisti jo alulle laitetut toimenpiteet aivan kun omina ideoinaan.
1,Kiitos lukuhetkestä : )
0,"Vaikka tuo aluksi naurattaa, ei se ole edes mitään huumoria vaan pelottava totuus."
1,XD
0,Ei stana se mene pienen ihmisen järkeen!
0,mä oon ollu jo kauan masentunu..
1,"Elias = aivan ihana nimi ja miehenikin mielestä ihan varteenotettava, Noa= yksi minun henkilökohtaisista lemppareista mies ei ole ihan samaa mieltä."
1,"Mukava reissu, pitäisikin ottaa uusiksi..."
0,"Menkää töihin, Jonnekin muuannekin kun niihin tukitöihin, nekin saa muut maksaa."
0,Työvoimatoimistot voi lakkauttaa.
0,"Kateus on kamala asia, ja nyt kalahti pahasti paperimiesten omaan nilkkaan!"
1,tervehdys!
0,Minun Julius Spökmannen ei anneta kertoa omasta alibistani murha iltana kun tuo saatanan idiootti sensori poistaa sen.
0,"Itsekkäitä vanhoja sikoja, joille tulisi hätä jos vaimo potkisi pihalle."
1,hyvä vasemmistoliitto
0,"Niin itsekäs, että kunhan itse saa, niin mitäpä niistä jotka 'valitsevat' mielestäsi helvetin..."
1,Kiitos asiallisesta vastauksesta!!!
1,"näin ensimmäisen indyn varmaan juuri ja juuri kouluikäisenä videolta, ja näin painajaisia pitkään siitä kohtauksesta missä arkku imee tyypit sisäänsä :)"
0,"On se kamala kunta ja kamalat on virkamiehetki, ihan siellä istuvat ku piruuttaan."
1,nappasit:)) hyvin vedetty ja onnea vielä kerran.
1,kanaria parempi meille!mutta makuasioista ei kannata kiistellä...
1,Todella kiva!
0,"Mielenkiintoista tosiaan, että yhtään ilkeilevää kirjoitusta ei ilmesty silloin kun sinä et ole paikalla, mutta kaikki nuo eri persoonat ja eri nimimerkit ilmaantuvat sinun mukanasi."
0,"Joka näkyy vain hämärässä HYVIN pienessä osaa laitteita, ja jotka Apple vaihtaa uusiin ilmaiseksi, jos ne jotain sattuvat haittaamaan?!?"
1,"Niin tein minäkin ja sit oppii lisää, kun pyörä jättää välille.:)"
1,Kiitos vastauksista ja lisää vain ehdotuksia. :)
0,Johanna Tukiainen on turha julkkis.
0,Turha elätellä ja haaveilla Oulua pelastavana haltijana.
0,Viileän kohtaamisemme tänään...
0,Mahtava se on kun sitä markkinoidaan roskalehtien idiooteille toimittajille.
1,Viimeksi teettin puvun ja halvalla sai.
1,Asia on Hesarin palstalla ihan päinvastoin.:D
1,Hän osaa kirjoittaa hyvin kauniisti ja vetävästi
0,"Vittu kyllä haltijakin voi vitun autonsa myydä jos vain on sen vitun omistaja suostumus tai joku muu vitun sopimus, vaikkapa jollakin vitun pahvilla."
0,Se tarkoitaa just sitä tavallista mineraaliöljyä että KUKKUU ja herätys sinnekin.
1,"Pärjäät varmasti, tsempiä."
0,Auton ostajan olisi kannattanut sopia eikä kinastella oikeuksissa ja käyttäää aikaa yli 400 viestiin.
0,Torniosta rip
0,Tetenkin olen vihainen.
0,Nyt on niin jumissa ettei taaskaan mene kun kovalla tappelulla hiukan nestettä ja energiapitoista lientä.
0,Menkää pelaan kolffia niitten hihhulikavereitten kans!
0,"Kovia kokenutta mamua ja hänen tietämättömyyttään ei saa käyttää hyväkseen kielipoliittisessa pelissä, kuten surutahot ovat tehneet."
1,2. sims 2 petzin pitäis ilmestyä [] NYT [x] kun naksautan sormiani :D
1,:):)
0,"KYLLÄ VOI, SILLÄ AHNEUDEN JA VALLAN SOKAISEMAT VIRKAMIEHET JA KANSANEDUSTAJA POLITIKOT OVAT VALMIITA TEKEMÄÄN MITÄ TAHANSA OMAN EDUN TAVOITTELUSSA, SIIS MITÄ TAHANSA, JOPA RYÖSTÄMÄÄN LEIVÄN KERJÄLÄISEN KÄDESTÄ, NIIN HULLUJA SUOMEN POLITIKOT JA VIRKAMIEHET OVAT!!!!!!!!!!!!!!!!!!!!!!!!!!!!!!!"
1,Osaa jopa kirjainten sanelun perusteella kirjoittaa mitä tahansa.
0,mä vihaan näitä!
0,"Söin mä hampurilaisaterian siellä, oli vähän ällö."
0,"Näkee hänestä myös sen, että on passiivisena kuunnellut soopaa, ei ajatellut omilla aivoillaan mitä tulee terveyteen."
0,Sellaisille kavereille on turha enempiä kertoa.
1,Kiitti :3
0,tai sitten naisille joku emäntäkoulu pakolliseks..
0,Normi käytöstä ja haukkui Veijo Lallin samalla ja valehteli niikuin tämän jeesuksen morsiammen kuuluukin.
1,"Paljon onnea ja ihania, aurinkoisia kesäpäiviä :)"
1,"Muuten Hyvää Uutta Vuotta kaikille ihanille keski-ikäisille pehmeille, kiihkeille naisille!"
1,Näillä odottajilla liukuu elämä ohi ihan huomaamatta ;)
0,"Fennoilla on kuitenkin hölmöä uskoa, koska he luulevat syyttelyllä aikaansaavansa helpotusta elämäänsä."
0,Siis se vanha ja oikea Pokémaster Harwey mutta päätin vaihtaa nimeni True Harweyksi ainakin vähäksi aikaa ellei ikuisesti sen idiootti Lugian takia... &gt;:C
0,"Opettajillakin lähes kolmekuukautta luppoaikaa, menisivät vaikka kielikursseille tai kesäyliopistoon parantamaan ammattitaitoaan."
1,Loput on muuten kivoja ja seassa joku vip-henkilö.
1,siilin tori on aivan hyvä ja kesällä siellä on tunnelmaakin.
0,Täyttä paskapuhetta!
1,"Johanna ja Julia Tukiainen Show Rauman Onnelassa, tervetuloa!!! :)"
0,"joskus joku laittaa minutkin joku päivä ruumisarkkuun.se on vain niin.juokse semme kilpaa kuoleman kanssa eikä sille voi mitään, se on niin lopullista ja surullista.se on todellista, en ennen tajunnut sitä mutta olen oppinut sen.kuolema on niin tyhjä, niin kolkko, niin loppu.hauta on viimeinen paikkamme tässä maailmassa."
1,Kiitos Sinulle vastauksesta.
1,Olisin erittäin kiitollinen avusta!
0,"Ja kokoelmat paskana:
0	0	0	0	3	0	-1	13	8	comments2009f.vrt 1544280	Siksi ihmettelenkin miksi niin usein sanotaan, että seuraavaan suhteeseen kantaa vanhan suhteen ongelmat.
0	0	0	0	3	1	-1	13	8	comments2013a.vrt 999356	Mutta..
0	0	0	0	3	0	0	1	8	comments2006d.vrt 481589	voihan nekin mennä puhki.
0	0	0	0	3	0	0	2	8	comments2009e.vrt 275975	Odottele sitä velontaa ja odottelun ohessa voisit käydä käräjäoikeuden info pisteessä tai hakea juriidista apua oieusaputoimistosta jos käsittelyssä sinulla ei ollut juristia katsomassa onko vangitsemiseen perusteet vedoten olemassaoleviin asioihin .
0	0	0	0	3	0	1	4	8	comments2007b.vrt 1605380	En voisi kuvitellakaan itse asiassa ...
-1	-1	-1	-1	1	0	1	2	8	comments2018c.vrt 561076	Kun linkki ei tullut tarpeeksi nopeasti niin siitä heti nälvit.
0	0	0	0	3	0	1	20	8	comments2006e.vrt 3146285	Nainen sai omaisuutta, mutta aviomies tai holhooja hallitsi sitä.
1	0	0	0	4	0	-1	12	8	threads2011a.vrt 1396489	Mielenkkinnolla odottelen hylkäystilastoja
0	0	0	0	3	0	-1	19	8	comments2011a.vrt 1176974	Unileluista huolehtimisesta taas, niin pienten ryhmässä jossa on 12 lasta ja ainakin kolme hoitajaa ei ole laisinkaan mahdotonta miettiä yhdessä lasten ja vanhempien kanssa miten unileluasia yhdessä hoidetaan."""
0,"Mut on myös poistettu kaverina ja monta kertaa ihmiset on torjuneet mun kaveripyynnön, vaikka samoista kuvioista ketään muita ei olisikaan torjuttu :("
0,"..."""
0,"En itsekään ole hänen kanssaan kovin paljon tekemisissä, ön nääs narsisti tyyppi."
0,hulabaloota.
1,"tätä aikasi kuluksi meillä molemmilla ikää 68vuotta, seurustella alettiin 15 kesäsinä avioon 17v ensimmäinen lapsi 25v ei kumpainenkaan ole koskaan katunut yhteistä avioliittoa rakkautta on riittänyt tasapuolisesti molemmille myös lapsille."
0,"Ei varmaan tahallaan, vaan siksi että ei oikeasti tajua itsekään."
0,Eikä asia parane sillä että yksi kusettaja tutkii toista kusettajaa.
1,..voi kun mun silmmiini kiinni jäisitkin!
1,"Hyvä koulu, kannattaa käydä!:)"
0,sydän täynnä sirpaleita
0,"Silloin kun tuodaan tollaista potaskaa ja mainitaan Jeesus tai Jumala tällaisen yhteydessä, niin se on todella HÄRSKIÄ touhu Tuossa EI OLE RIPAUSTAKAAN USKOA JUMALAAN, Jeesukseen."
0,Se tykkää vähän saatanasti kaasunpummpaamisesta parkkipaikalla!!!
0,Ihan hullua porukkaa................................................
0,ei ole ihme ettet mitään tajua.
1,:)
1,Hallelujah Yeshuan nimessä!
0,"Muitten vikahan se on, ettet sinä pysty hyvään ja korkeatasoiseen keskusteluun?"
1,teen graduani henkisestä jaksamisesta turva-aloilla vastaukset olisi kivoja
0,"Sitten kun hermostuin ja loukkaannuin siitä että hän arvosteli pukeutumistani niin sanoi että olen yliherkkä, ""ai en tiennyt että olet noin herkkä, mä yritin vaan auttaa sua""."
0,"Milloin oikein opit että jeesus ei ole uskonto-yhteydessään erisnimi vaan jotain ihan muuta, siksi jeesus kirjoitetaan pienellä kirjaimella."
1,"Olen erittäin lapsirakas ja yleensä lapsetkin pitävät minusta, ja kuten sanoin olen avoin kaikille työtarjouksille joten kysy rohkeasti!"
1,Onnea teille jokaiselle!
1,Pärjään kyllä.
1,suosikkini on varmaankin anna ja onhan se toinenkin uusi asukas ihan nice: ) INHOKKINI ON EHDOTTOMASTI MARIANNE!
0,Kohta kukaan ei enää jaksa kiinnostua.
1,Onhan minulla hypoabsoluuttis-sensitiivinen sävelkorva ja olen muutenkin täydellinen.
0,"Jotain vikaa sinussa pitää olla, kun uskot."
1,Kannatan.
0,"Mutta FAKTA-OSIO on surullista luettavaa, sitä samaa, mikä bio-vanhemmille on yleensä tuttuakin tutumpaa:"
1,"Kiitos vinkistä:)Mitä luulet, kertoisiko hän minulle, jos häntä ahdistaisi yhteydenpitoni?"
1,Kiitos vielä ehdin muuttaa tiettyyn hotelliin..
0,Hakukaan ei löydä mitään zonelabsiin viittaavaa.... :( nyyh nyyh...
1,Jokainen saa olla mitä on ja sekin on auttanut minua.
0,"Harmittaa joskus suunnattomasti, kun tietää kuolevansa, mutta ei minulla mitään sellaisia kuvitelmia ole, että jokin ""minä"" olisi vielä kuoleman jälkeen olemassa."
1,Toivottavasti kaikki tarkoitetaan eri henkilöä:).
0,"Olen itse ollut isätön 36-vuotta, vaatimalla ja uhkaamalla sain äidin lopulta kertomaan asiasta."
0,kyllä erikoinen tapaus tuo nainen..
1,Hyvät.
1,"Hyvä, jos tunnet onnistuneesi uskossasi, mikäpä minä olen siihen mitään sanomaan."
1,Suosittelen rohkeasti vain kokeilemaan!! :)
0,"Palstan paskaväki väittää vastaan, mutta että ihan päämulkku, psykopaatti tuli näyttämään tyhmyyttään!!"
0,"Ei ole merkitystä että onko sillä takuuta jos sitä ei kiinnosta sellaisenaan käyttää joten ei ole iso vahinko vaikka menisikin ja tuolla olisikin mielenkiintoista harjoitella miten roottaus vaikuttaa, ja niinkuin sanoin niin jos ei kummene niin paiskaan sen seinään sillä niin onneton kapistus se kaikinpuolin on."
1,olen ihan samaa mieltä.
1,Tyylikästä.
0,"Jos mies olis tehnyt saman, hänkin roikkuisi nyt hirressä, oli naru sitten löysä eli ei."
1,"Lisäyksenä vielä, että se kilikilikello on erittäin suositeltava."
1,kiva.
1,Tornio on kaunis kaupunki
1,"Mitä ihmettä, ei tuu listoja, siellähän sepät on asialla=))"
0,ystävällisesti siirtyä pois pilaamasta minun luomaani keskustelua.
0,Se on rasittavaa jos aina kun toinen koskee tietää että nyt se haluaa seksiä.
0,Taasko tätä ilmaisen energian vastustajan päähänpinttymien jankutusta..
0,"Oon yrittäny puhdistaa korvaani, mutta heti, kun vähänkin sinne jotain työntää, niin alkaa jyskyttävä kipu.. :("
0,"mikä vittu sua vaivaa?? onx sul joku ""titteli"" ?? teinit on meijän tulevaisuus ja luulis sunki vähä arvostavan niitä :D"
1,Hän on herttainen mutta vaatimaton ihminen.
1,Hienoa EK
1,Kivoilta vaikuttivat kaikki ja kiva kun tähän topaan on eksynyt noin erilaisia bloggaajia! :)
1,"Itse olin Brysselissä puoli vuotta, ja siellä varsinkin saa helposti kavereita( Brysselissä asuu todella paljon suomalaisia)."
1,Käymme yhdessä reissuissa ja vanhempani hyväskyvät hänet ihan täysin.
0,Ei ollut oikein kivaa.
0,"Lapsesi menettivät vanhimman sisaruksensa.
1	1	0	1	4	1	1	12	5	comments2010e.vrt 3417902	pois murhemieli rinnasta paistaa hymy runostasi lukijalle ja voi että kuinka hyvä on viimeinen kappale kauniissa runossasi.
0	-1	0	0	2	1	-1	16	5	comments2007e.vrt 2692995	Itselläni myös se ongelma, että en selittänyt teorioita lainkaan, vaan mainitsin esim.
0	0	0	0	3	0	-1	20	5	comments2005b.vrt 1428861	Kansi ja siipipyörä nostettava akselilta äläkä hukkaa sitä pientä kiilaa, jonka avulla pumppu saa käyttövoimansa vetoakselilta.
1	0	0	0	4	-1	0	18	5	comments2010c.vrt 243073	Niitä aikaansa ja vaivaansa uhranneita, joille ratkaisuni on vaikea sulattaa, voin lohduttaa sillä, että sen tekeminen oli vielä vaikeampaa.
0	0	0	0	3	0	-1	19	5	threads2013b.vrt 1400024	[URL=http://aijaa.com/xneCs8]http://aijaa.com/xneCs8[/URL]
0	-1	0	0	2	0	-1	11	5	comments2013d.vrt 1758231	Ei oo oikein viimevuosina noussu.
0	0	0	0	3	-1	-1	6	5	comments2015d.vrt 1181147	Aloitus kai tarkoitti kiinnittää huomiota siihen asiaan että kaksi suurinta ketjua tekee samanlaaisen päätöksen samanaikaisesti, ei vaokuvauksen muuttumisesta.
0	-1	0	0	2	0	0	2	5	threads2007b.vrt 1557335	En tiedä mistä on kysymys, kun en saa yhteyttä millään tavalla.
0	0	0	0	3	-1	0	11	5	comments2006d.vrt 439846	No joo, eihän tähän kohteeseen kannattanut kaikkia lyödä.
1	1	0	1	4	1	1	11	5	comments2005d.vrt 1200566	Janni Elena -&gt; ihan ok
0	-1	0	0	2	0	-1	3	5	comments2010a.vrt 1228288	Onhan tämä ketju otsikoitu nimeäni käyttäen: Weijo tyrmää!"""
0,"Kepulainen Hirvonen siirrettiin toisiin hommiin, ettei vain kajoasi kokkareiden puuhiin!"
0,Iso ihminen siellä ei taida olla tyytyväinen elämään kun pienempiään kiusaa?
0,"Mä kärsin uniongelmista, mutta ne on sekä syy että seuraus syömishäiriössä ja alakulossa."
0,en ole koskaan tuntenut mitään näin kauheeaa olin silloin vielä paikalla kun hänen äiti kuoli.
0,Itse en enää koske tikullakaan värilaaseriin.
0,Mistä sinä idiootti tuohon persut keksit??
0,"Perusajatus oli silloin sama kuin nykyisinkin eli;hallitukset salailevat,ilmavoimat salailevat,viranomaiset salailevat ja MIB:t vainoavat."
0,Onko mikään ärsyttävämpää ja loukkaavampa heidän OMIA LAPSIAAN kohtaan?
1,itse olen saanut niin apua kuin hyvät naurutkin monesti hulluille kirjoituksille.
0,"Anteeksi muuten provosoiva kielenkäyttöni, mutta sitä oli omasikin."
1,"Mukavaa sullekin, Seijasini :)"
0,Pätteleppä itte.
0,Jumala rankaisee sinua vaihtokauppamies.
0,Sun ainoa säälittävä kriteeri on että aloittajan elatusmaksut tulee palkkatunneilla tehdyistä ansiotuloista.
